{"arch":"gemma4","backend":"htp","backend_build":"sha256:80e787b89b1f1030d85c410e0d4f78607c94e98c85e74f84440832e8e1f4fca1","boot_epoch":7,"derived_bytes":0,"derived_image_digest":"sha256:1b00cfa2bc07e1211c52360a98b1d0f9192827d81934cb406fb933d111218f0f","derived_payload_sha256":"sha256:b11f61138f7530abd245cf2f9c4ac1d84b5f899181ed033d54b16fd0433bcaa7","graph_hash":"sha256:b3c3cb5513880375f4d96a51ee23629e027baa8a3b3ed7551f34acbe5309d620","image_class":"htp_linear","kind":"prepared_image","layout_version":3,"model_version":"sha256:a2116482dd84e547aed9e9b02621f38361e02ecaa0b55269e4d2e4e8a79558b5","preparation_algorithm":"htp_repack.v1","prepared_image_id":"pi1","residency_generation":2,"schema_version":3,"sharing_mode":"shared_canonical","soc":"op15","source_allocation_id":"alloc-ws1","source_weight_set_digest":"sha256:3fa601b781e2ade54ab442125e635520389c4289329ba9ec2fd819e8e165ebc2","source_weight_set_id":"ws1","tensor_digest":"sha256:3fa601b781e2ade54ab442125e635520389c4289329ba9ec2fd819e8e165ebc2"}
